date	posted_time	topic	content_theme	angle	hook_type	hook_text	word_count	line_count	has_numbers	has_question_cta	has_image	hashtag_count	lead_magnet_type	total_reactions	likes	insight_reactions	comments	reposts	engagement_score	comment_ratio	insight_ratio	scraped_at
2026-04-23	02:05					We're making a big change to the Copilot experience.	96	5	false	false	true	0		3920	3406	78	221	376	5335	0.0564	0.0199	2026-04-24
2026-04-22	21:19					Every agent will need its own computer. And with new Hosted agents in Foundry, every agent gets its own dedicated enterp	44	2	false	false	true	0		4734	4118	129	247	500	6475	0.0522	0.0272	2026-04-24
2026-04-21	01:27					Great to meet with the Beca team in Auckland and see how they are using Azure, Foundry, and their BEYON platform to make	65	3	false	false	true	0		2215	1947	15	173	131	2996	0.0781	0.0068	2026-04-24
2026-04-20	00:19					When it comes to Excel, Diarmuid Early is in a different league.	26	2	false	false	true	0		3893	3402	45	187	174	4802	0.048	0.0116	2026-04-24
2026-04-16	15:21					Our Fairwater datacenter in Wisconsin is going live, ahead of schedule.	42	3	false	false	false	0		898	715	12	98	110	1412	0.1091	0.0134	2026-04-24
2026-04-14	18:24					Live in Foundry today: MAI-Image-2-Efficient, 40% faster rendering than other top image generation models.	17	1	true	false	false	0		1070	942	12	59	71	1389	0.0551	0.0112	2026-04-24
2026-04-13	21:09					Need to step away or just want to continue working on a different device? You can now remote control GitHub Copilot CLI 	49	3	false	false	true	0		1104	969	16	54	137	1540	0.0489	0.0145	2026-04-24
2026-04-11	01:39					In GitHub Copilot CLI, you can now leverage a multi-model reflection loop as a reviewer.	25	2	false	false	false	0		1374	1205	65	99	115	1901	0.0721	0.0473	2026-04-24
2026-04-02	16:22					We’re bringing our growing MAI model family to every developer in Foundry, including …	48	5	true	false	true	0		5124	4450	72	288	423	6834	0.0562	0.0141	2026-04-24
2026-03-31	20:01					Excited to see Open to Work from my colleagues Ryan and Aneesh out in the world. Ryan told me months ago he wanted to wr	72	1	false	false	false	0		1384	1183	9	120	47	1838	0.0867	0.0065	2026-04-24
2026-03-30	15:05					Introducing Critique, a new multi-model deep research system in M365 Copilot.	32	3	false	false	true	0		7719	6709	190	319	925	10526	0.0413	0.0246	2026-04-24
2026-03-19	18:26					Great to see our new image model from our Superintelligence team rolling out in Copilot and coming soon to Foundry for e	23	1	false	false	false	0		1145	984	11	126	73	1669	0.11	0.0096	2026-04-24
2026-03-15	14:51					This is a great example of why we do what we do.	46	3	false	false	true	0		5438	4569	297	410	539	7746	0.0754	0.0546	2026-04-24
2026-03-13	18:50					We’re the first cloud to bring up an NVIDIA Vera Rubin NVL72 system for validation, another big step in building the nex	29	1	false	false	true	0		12139	10580	120	509	821	15308	0.0419	0.0099	2026-04-24
2026-03-12	17:55					We're approaching the dawn of medical superintelligence - the moment when affordable, world-class medical knowledge and 	324	11	true	false	true	0		2127	1687	91	265	283	3488	0.1246	0.0428	2026-04-24
2026-03-09	14:02					Announcing Copilot Cowork, a new way to complete tasks and get work done in M365.	58	3	false	false	true	0		12984	11157	285	536	1706	18004	0.0413	0.022	2026-04-24
2026-03-05	19:10					Healthcare has never moved faster or asked more of clinicians.	48	2	false	false	true	0		1972	1697	27	134	188	2750	0.068	0.0137	2026-04-24
2026-03-04	15:10					I’ve been trying Copilot Tasks this week, and it’s awesome to assign tasks (even recurring) in this cowork mode and have	79	3	false	false	true	0		5364	4721	259	336	409	7190	0.0626	0.0483	2026-04-24
2026-03-03	20:59					Counting down to a new Build in San Francisco. Hope you’ll join us! https://aka.ms/AA101fmo	18	1	false	false	true	0		4208	3628	20	133	367	5341	0.0316	0.0048	2026-04-24
2026-02-25	17:44					Great to meet with members of the Munich Fire Department in Germany today and see how they’re using our agent platform t	37	2	false	false	true	0		1135	978	61	114	77	1631	0.1004	0.0537	2026-04-24
2026-02-24	12:30					We’re building the most comprehensive digital sovereignty platform to help countries and organizations meet their regula	59	3	false	false	true	0		3990	3436	203	368	488	6070	0.0922	0.0509	2026-04-24
2026-02-21	00:00					Today I am honored to step into the role of CEO of Microsoft Gaming.	296	7	true	false	true	0		17538	12751	28	1377	188	22045	0.0785	0.0016	2026-04-24
2026-02-18	15:06					Today in Delhi, we’re sharing that Microsoft is on pace to invest USD $50 billion by the end of the decade to help bring	107	3	true	false	false	0		1203	998	12	94	123	1731	0.0781	0.01	2026-04-24
2026-02-09	05:10					Congrats to our hometown Super Bowl champs! So thrilled for our city and the 12s!	15	1	false	false	true	0		11819	9228	7	307	200	13140	0.026	0.0006	2026-04-24
2026-01-29	00:55					Just reported our quarterly results.	421	21	true	false	false	0		7096	5955	309	571	440	9689	0.0805	0.0435	2026-04-24
2026-01-26	17:02					Our newest AI accelerator Maia 200 is now online in Azure.	86	5	true	false	true	0		11971	10192	160	505	1345	16176	0.0422	0.0134	2026-04-24
2026-01-23	16:20					So much of dev work happens in the context of a larger team, and now you can bring all of that work context into the Git	39	2	false	false	true	0		1901	1658	95	166	187	2773	0.0873	0.05	2026-04-24
2026-01-22	15:06					Excited to partner with the Mercedes-AMG PETRONAS F1 Team to apply our technology from factory to circuit, turning massi	35	1	false	false	false	0		1920	1590	13	86	89	2356	0.0448	0.0068	2026-04-24
2026-01-21	16:08					Introducing Rho-alpha, our newest robotics model from Microsoft Research. Rho-alpha turns natural language into precise 	51	3	false	false	true	0		4176	3584	99	240	363	5622	0.0575	0.0237	2026-04-24
2026-01-16	02:52					Education has always been at the heart of Microsoft's mission. With today’s launch of Microsoft Elevate for Educators an	91	5	true	false	true	3		803	619	11	83	111	1274	0.1034	0.0137	2026-04-24
2026-01-13	14:33					As we continue to expand our AI infrastructure, we’re committed to being a good neighbor in the communities where we bui	49	3	false	false	true	0		2591	2243	33	248	216	3767	0.0957	0.0127	2026-04-24
2026-01-08	16:14					Today, we released Microsoft's newest AI Diffusion Report, and I sat down with Juan M. Lavista Ferres, Chief Data Scient	124	4	false	false	true	1		1204	1030	77	143	190	2013	0.1188	0.064	2026-04-24
2025-12-29	20:35					A few reflections on the year ahead for our industry ... https://lnkd.in/gwygrzzB	14	1	false	false	true	0		4072	3498	289	357	375	5893	0.0877	0.071	2026-04-24
2025-12-19	22:23					We are bringing a little holiday cheer to Copilot!	28	2	false	false	true	0		5339	4684	32	389	354	7214	0.0729	0.006	2026-04-24
2025-12-12	08:16					Great meeting Chief Minister Devendra Fadnavis today to discuss how AI can have real impact for people across Maharashtr	38	2	false	false	true	0		3585	3218	27	245	180	4680	0.0683	0.0075	2026-04-24
2025-12-11	06:25					It was fun to spend time with the team at Swiggy today, and see how they're using Microsoft Fabric to process billions o	55	1	false	false	true	0		4419	3975	35	153	210	5298	0.0346	0.0079	2026-04-24
2025-12-10	07:35					Every time I visit India, I'm struck by how AI is already starting to have a profound impact on people's lives.	66	2	true	false	true	0		3580	3188	37	198	140	4454	0.0553	0.0103	2026-04-24
2025-12-09	14:02					Thank you, PM Narendra Modi ji for an inspiring conversation on India’s AI opportunity. To support the country’s ambitio	49	1	true	false	true	0		27566	23997	62	492	668	30378	0.0178	0.0022	2026-04-24
2025-12-04	16:05					With the Excel World Championship underway, I decided to take the M365 Copilot digital challenge. I’m no World Champ… bu	29	1	false	false	true	0		6412	5473	80	338	462	8350	0.0527	0.0125	2026-04-24
2025-11-25	01:02					AI and quantum are transforming how we tackle the toughest scientific challenges—from sustainable materials and clean en	112	3	false	false	false	5		421	358	15	50	48	667	0.1188	0.0356	2026-04-24
2025-11-18	16:09					"10 PRINT ""ANTHROPIC + MICROSOFT + NVIDIA = MORE COMPUTE, COGNITION, AND CHOICE."""	10	1	true	false	true	0		17768	15118	280	768	1687	23446	0.0432	0.0158	2026-04-24
2025-11-15	19:09					I’ve been thinking a lot about what the net benefit of the AI platform wave is. The real question is how to empower ever	65	1	false	false	false	0		7319	6289	513	524	435	9761	0.0716	0.0701	2026-04-24
2025-11-12	18:05					Today we announced our new Fairwater datacenter in Atlanta, connected with our first Fairwater site in Wisconsin and our	351	11	true	false	true	0		9590	8145	149	576	1089	13496	0.0601	0.0155	2026-04-24
2025-11-06	18:43					Here’s a question that’s not getting the attention it deserves: what kind of AI does the world really want? I think it's	482	9	true	false	true	0		3496	2745	272	557	384	5935	0.1593	0.0778	2026-04-24
2025-11-05	18:54					Agents will keep joining and adapting at work — some may become double agents. With proper controls, we can protect ours	43	1	false	false	true	0		290	252	21	26	42	452	0.0897	0.0724	2026-04-24
2025-11-04	02:20					1.1M tokens/sec on just one rack of GB300 GPUs in our Azure fleet. An industry record made possible by our longstanding 	39	1	true	false	true	0		4935	4271	87	217	278	6142	0.044	0.0176	2026-04-24
2025-10-30	18:23					We're taking the next big step with Researcher.	46	2	false	false	true	0		5645	4898	278	263	576	7586	0.0466	0.0492	2026-04-24
2025-10-29	00:46					I love how easy it’s becoming to learn on the go with podcasts in Copilot.	48	2	true	false	true	0		4585	3931	261	244	325	5967	0.0532	0.0569	2026-04-24
2025-10-28	00:34					We’re continuing to make Copilot even more helpful in the everyday flow of work. Teams Mode lets groups co‑create with C	31	1	false	false	true	0		3188	2809	59	158	236	4134	0.0496	0.0185	2026-04-24
2025-10-24	19:56					So many new Copilot updates this month. Here are some I can't stop using.	15	1	false	false	true	0		9532	8511	128	307	698	11849	0.0322	0.0134	2026-04-24
2025-10-23	18:11					All of today's Copilot announcements boil down to one core idea: we're betting on humanist AI. An AI that always puts hu	324	14	true	false	false	0		3110	2479	89	289	471	4919	0.0929	0.0286	2026-04-24
2025-10-21	18:52					At Microsoft, we believe agentic business applications are the future of enterprise transformation. With Dynamics 365, o	59	1	true	false	true	0		849	748	7	50	174	1347	0.0589	0.0082	2026-04-24
2025-10-16	00:41					Let's go, M's!	5	1	false	false	true	0		6250	4510	8	180	193	7176	0.0288	0.0013	2026-04-24
2025-10-15	22:06					OpenAI’s Sora 2 is now rolling out to enterprise customers on Microsoft Azure Foundry.  I gave it a spin today and I thi	38	1	true	false	true	0		1495	1293	15	58	145	1959	0.0388	0.01	2026-04-24
2025-10-14	20:58					"This is super useful! With new Formula Completions in Excel, just type ""="" and Copilot proactively suggests a formula, b"	30	1	false	false	true	0		7308	6404	373	321	495	9261	0.0439	0.051	2026-04-24
2025-10-13	22:33					Meet our third Microsoft AI model: MAI-Image-1! #9 on LMArena, striking an impressive balance of generation speed and qu	40	2	true	false	false	1		2328	1995	35	132	185	3094	0.0567	0.015	2026-04-24
2025-10-12	22:52					We've been hard at work advancing M365 Copilot, and so have our many partners who are building agents that integrate wit	37	1	false	false	false	0		5660	5052	67	236	544	7456	0.0417	0.0118	2026-04-24
2025-10-09	18:15					Another first for our AI fleet ... a supercomputing cluster of NVIDIA GB300s with 4600+ GPUs and featuring next gen Infi	53	2	true	false	true	0		11575	10220	139	420	895	14625	0.0363	0.012	2026-04-24
2025-10-07	01:39					Big news from DevDay: the latest OpenAI models are now live in Azure AI Foundry. GPT-5-Pro raises the bar on reasoning a	103	3	true	false	true	0		1456	1298	15	55	185	1991	0.0378	0.0103	2026-04-24
2025-10-05	00:58					Super to see re Agent Mode: “It really does do something new: it makes Excel feel less like a tool you command and more 	34	2	false	false	true	0		1390	1230	61	105	66	1837	0.0755	0.0439	2026-04-24
2025-10-04	03:10					Friday evening reflection: Adjusting my cloud infra priors for the AI era… a colleague just shared the progress we are m	62	1	true	false	false	0		4105	3494	79	218	90	4939	0.0531	0.0192	2026-04-24
2025-10-03	00:30					Learning just leveled up: from now through October 31st, eligible college + university students can claim extra access t	76	4	true	false	true	0		901	716	8	60	166	1413	0.0666	0.0089	2026-04-24
2025-10-02	20:01					Published today in Science Magazine: a landmark study led by Microsoft scientists with partners, showing how AI-powered 	52	2	false	false	true	0		1684	1462	93	103	111	2215	0.0612	0.0552	2026-04-24
2025-10-01	01:01					Today marks a new chapter for defenders everywhere. With the evolution of Microsoft Sentinel into a unified, AI-ready se	128	4	false	false	true	0		1285	1044	22	59	192	1846	0.0459	0.0171	2026-04-24
2025-09-30	18:43					"Happy 40th, Excel! =REPT(""🎉"",40)"	35	2	true	false	false	0		7923	6350	19	383	356	9784	0.0483	0.0024	2026-04-24
